{
  "artifact_path": "fetched/source-001/response.html",
  "bytes_saved": 528,
  "content_type": "text/html",
  "duration_ms": 383,
  "error_message": null,
  "fetched_at": "2026-06-06T16:32:15Z",
  "final_url": "https://example.com/",
  "http_status": 200,
  "redirect_chain": [],
  "requested_url": "https://example.com/",
  "run_id": "2026-06-06-sample-self-hosted-deep-research-agent",
  "schema_version": 1,
  "sha256": "fb91d75a6bb430787a61b0aec5e374f580030f2878e1613eab5ca6310f7bbb9a",
  "source_id": "source-001",
  "status": "fetched",
  "truncated": false
}
